{
  "$schema": "https://agentsentry.dev/schemas/agentdojo-native-replay-v1.json",
  "protocol": {
    "name": "agentsentry.agentdojo.native-eval-replay",
    "version": "1.0.0"
  },
  "visibility": "public_aggregate",
  "source": {
    "model": "deepseek/deepseek-v4-pro",
    "arm": "no-defense",
    "run_id": "agentdojo-native-20260809T062111Z-d3dd5e1f",
    "release_commit": "a6ee0314025f464809249494b48a33d2c03bd47a",
    "benchmark": "AgentDojo v1.2.2 workspace",
    "selection_sha256": "476178ca36f7c46579bbe5c69ef2a325f2750bfd311aa825e61197ce0708e16e",
    "detector_transcript_sha256": "7c4e8e07958726e6fb367d3cad71299878bb8676958eddfa3c075f67b3e623e9",
    "audit_scope": "observed attack-related high-risk side-effect trials"
  },
  "policy": {
    "profile": "competition",
    "enforcement_mode": "approval",
    "manifest_mapping_version": "1.2.0",
    "manifest_file_sha256": "157b03c47018ad1533a74ffacc7c58a5b22b68c12166e2aa5277b9f4d33cc9eb",
    "judge_disabled": true,
    "policy_release_commit": "a6ee0314025f464809249494b48a33d2c03bd47a",
    "bridge_script_sha256": "b2908dbecf5ca3b25efd477a720660ef4b2ffa89c842a3ca6079ee9106c728ef",
    "plugin_dist_sha256": "3145aff94ef54896bf8c0fa239885e886c05c0665e3b3ae96cc01b331e4f15a5",
    "replay_semantics": "enforced_prefix; skipped after_tool never executes a benchmark tool"
  },
  "coverage": {
    "observed_side_effect_trials": 46,
    "replayed_side_effect_trials": 46,
    "target_sink_calls": 115,
    "target_sink_decisions": {
      "deny": 46,
      "unreachable": 69
    },
    "trial_decisions": {
      "deny": 46
    },
    "protected_trials": 46,
    "input_mismatch_count": 0,
    "replay_transcript_sha256": "e9e79d48588921b141a26cfa1567db3dd4a466085cfeaa040c6cf6ebb8be73ed",
    "side_effects_executed": false
  },
  "interpretation": "Trial-level observed-malicious-sink replay coverage counts trajectories intercepted at or before malicious-sink execution. Call-level deny counts only reached blocking boundaries; downstream target calls after the first intervention are unreachable, not independently executable policy decisions. This is not end-to-end ASR and not a matched generation replay."
}
